{
  "createdAt" : "2026-07-12T23:08:54Z",
  "device" : {
    "appBuild" : "8",
    "appSourceCommit" : null,
    "appVersion" : "0.6.0",
    "batteryLevelPercent" : 50,
    "batteryState" : "unplugged",
    "buildConfiguration" : "Release",
    "debuggerAttached" : false,
    "displayName" : "iPhone 14 Pro Max (iPhone15,3)",
    "lowPowerModeEnabled" : false,
    "machineIdentifier" : "iPhone15,3",
    "systemBuild" : "23F77",
    "systemName" : "iOS",
    "systemVersion" : "26.5"
  },
  "eligibility" : {
    "officialLeaderboardEligible" : false,
    "reasonCodes" : [
      "pilot_protocol_not_official"
    ],
    "sessionValid" : true
  },
  "generationConfiguration" : {
    "chatTemplateIdentity" : "artifact-tokenizer-config-enable-thinking-false",
    "contextPolicy" : "new-context-for-each-generation",
    "includeStopTokenInRawEvents" : false,
    "kvCachePolicy" : "new-cache-for-each-generation",
    "modelLoadPolicy" : "load-once-before-warmup",
    "outputTokenLimit" : 128,
    "repetitionPenalty" : null,
    "samplingEnabled" : false,
    "seed" : 0,
    "temperature" : 0,
    "thinkingMode" : "disabled-via-chat-template",
    "topK" : 0,
    "topP" : 1
  },
  "measurementMode" : {
    "decodeFormula" : "(raw_token_count-1)/(last_raw_token_time-first_raw_token_time)",
    "id" : "b-mode-warm-resident-ux-v1",
    "memoryMetric" : "TASK_VM_INFO.phys_footprint",
    "memorySamplingIntervalMilliseconds" : 50,
    "pipelineTTFTEnd" : "first-raw-token-received-by-adapter",
    "pipelineTTFTStart" : "after-chat-template-and-tokenization-immediately-before-generateTokensTask",
    "prefillSource" : "mlx-generate-completion-info-prompt-time",
    "timingBoundaryVersion" : "mlx-ux-visible-boundaries-1",
    "userVisibleTTFTAvailable" : true
  },
  "model" : {
    "artifactID" : "mlx-community/Qwen3-0.6B-4bit",
    "artifactRepositorySizeBytes" : 682323786,
    "artifactRevision" : "73e3e38d981303bc594367cd910ea6eb48349da8",
    "baseModelID" : "Qwen/Qwen3-0.6B",
    "compatibilityConstraints" : [
      "runtime:MLX-Swift-LM-3.31.4",
      "backend:MLX/Metal",
      "architecture:qwen3-dense",
      "pilot-reference-device:iPhone15,3",
      "physical-run-required-before-publication"
    ],
    "displayName" : "Qwen3 0.6B",
    "licenseIdentifier" : "apache-2.0",
    "licenseSourceURL" : "https://huggingface.co/Qwen/Qwen3-0.6B/blob/c1899de289a04d12100db370d81485cdf75e47ca/LICENSE",
    "modelFamily" : "Qwen3 dense",
    "modelFormat" : "MLX Safetensors",
    "parameterSizeClass" : "small-0.6b",
    "quantization" : "4-bit",
    "sourceURL" : "https://huggingface.co/mlx-community/Qwen3-0.6B-4bit/tree/73e3e38d981303bc594367cd910ea6eb48349da8",
    "tokenizerIdentity" : "mlx-community/Qwen3-0.6B-4bit@73e3e38d981303bc594367cd910ea6eb48349da8/tokenizer_config.json"
  },
  "modelPreparation" : {
    "artifactID" : "mlx-community/Qwen3-0.6B-4bit",
    "artifactRevision" : "73e3e38d981303bc594367cd910ea6eb48349da8",
    "cacheStateBeforePreparation" : "cached",
    "cacheVerificationMethod" : "huggingface_revision_manifest_cached_file_size_v1",
    "downloadOccurredDuringSession" : false,
    "eligibleForPerformanceMeasurement" : true,
    "modelLoadCompleted" : true,
    "preparationCompleted" : true,
    "preparationDurationMilliseconds" : 291.138041,
    "preparedAt" : "2026-07-12T23:08:49Z",
    "reasonCodes" : [

    ]
  },
  "officialResultEligible" : false,
  "plan" : {
    "id" : "b-ux-001-validation",
    "measuredRuns" : 5,
    "minimumBatteryLevelPercent" : 50,
    "outputTokenLimit" : 128,
    "requiredPowerSource" : "unplugged",
    "runnerKind" : "single-session",
    "version" : "0.2.0-pilot",
    "warmupRuns" : 1
  },
  "resultID" : "ba496540-a56a-4ea2-9e63-a4f8dc0828ef",
  "runtime" : {
    "backend" : "MLX/Metal",
    "downloaderPackage" : "swift-huggingface 0.9.0",
    "mlxSwiftRevision" : "0bb916c67f4b9e5c682cbe02a42c701c93ab5021",
    "mlxSwiftVersion" : "0.31.6",
    "name" : "MLX Swift LM",
    "resolvedRevision" : "bd4b7434e6bdb588c7ef55706ff8904cb7fd4c57",
    "tokenizerPackage" : "swift-transformers 1.3.0",
    "version" : "3.31.4"
  },
  "schemaVersion" : "suite-b-result-bundle-0.3",
  "sessions" : [
    {
      "attempts" : [
        {
          "memorySamplingIntervalMilliseconds" : 50,
          "metrics" : {
            "decodeTokensPerSecond" : 101.9337019282132,
            "p50TokenIntervalMilliseconds" : 9.328271,
            "p95TokenIntervalMilliseconds" : 11.538219,
            "p99TokenIntervalMilliseconds" : 16.75841675,
            "peakMemoryMegabytes" : 804.0170516967773,
            "prefillTokensPerSecond" : 334.1209646904188,
            "requestCompletionMilliseconds" : 487.048291,
            "ttftMilliseconds" : 209.682791,
            "userVisibleTTFTMilliseconds" : 219.15975
          },
          "outcome" : "completed",
          "outputTokenCount" : 27,
          "promptTokenCount" : 70,
          "role" : "warmup",
          "runIndex" : 0,
          "stopReason" : "endOfSequence",
          "thermalStateAfter" : "nominal",
          "thermalStateBefore" : "nominal",
          "tokenEvents" : [
            {
              "elapsedNanoseconds" : 209682791,
              "index" : 0,
              "tokenID" : 7771
            },
            {
              "elapsedNanoseconds" : 228023291,
              "index" : 1,
              "tokenID" : 5185
            },
            {
              "elapsedNanoseconds" : 240035458,
              "index" : 2,
              "tokenID" : 374
            },
            {
              "elapsedNanoseconds" : 249946916,
              "index" : 3,
              "tokenID" : 6092
            },
            {
              "elapsedNanoseconds" : 258635333,
              "index" : 4,
              "tokenID" : 389
            },
            {
              "elapsedNanoseconds" : 266378583,
              "index" : 5,
              "tokenID" : 419
            },
            {
              "elapsedNanoseconds" : 275356833,
              "index" : 6,
              "tokenID" : 12167
            },
            {
              "elapsedNanoseconds" : 284542791,
              "index" : 7,
              "tokenID" : 323
            },
            {
              "elapsedNanoseconds" : 293812250,
              "index" : 8,
              "tokenID" : 686
            },
            {
              "elapsedNanoseconds" : 303080833,
              "index" : 9,
              "tokenID" : 12811
            },
            {
              "elapsedNanoseconds" : 312305750,
              "index" : 10,
              "tokenID" : 9463
            },
            {
              "elapsedNanoseconds" : 321589208,
              "index" : 11,
              "tokenID" : 3055
            },
            {
              "elapsedNanoseconds" : 330762958,
              "index" : 12,
              "tokenID" : 498
            },
            {
              "elapsedNanoseconds" : 340119375,
              "index" : 13,
              "tokenID" : 50036
            },
            {
              "elapsedNanoseconds" : 349296416,
              "index" : 14,
              "tokenID" : 311
            },
            {
              "elapsedNanoseconds" : 358616166,
              "index" : 15,
              "tokenID" : 279
            },
            {
              "elapsedNanoseconds" : 367872083,
              "index" : 16,
              "tokenID" : 3922
            },
            {
              "elapsedNanoseconds" : 377208875,
              "index" : 17,
              "tokenID" : 13
            },
            {
              "elapsedNanoseconds" : 386558875,
              "index" : 18,
              "tokenID" : 6771
            },
            {
              "elapsedNanoseconds" : 396329833,
              "index" : 19,
              "tokenID" : 752
            },
            {
              "elapsedNanoseconds" : 406118750,
              "index" : 20,
              "tokenID" : 1414
            },
            {
              "elapsedNanoseconds" : 415916416,
              "index" : 21,
              "tokenID" : 421
            },
            {
              "elapsedNanoseconds" : 425867833,
              "index" : 22,
              "tokenID" : 498
            },
            {
              "elapsedNanoseconds" : 435964875,
              "index" : 23,
              "tokenID" : 1184
            },
            {
              "elapsedNanoseconds" : 446081250,
              "index" : 24,
              "tokenID" : 4623
            },
            {
              "elapsedNanoseconds" : 455541375,
              "index" : 25,
              "tokenID" : 12994
            },
            {
              "elapsedNanoseconds" : 464750541,
              "index" : 26,
              "tokenID" : 0
            }
          ],
          "visibleText" : "Your note is safe on this iPhone and will sync automatically once you reconnect to the network. Let me know if you need further assistance!"
        },
        {
          "memorySamplingIntervalMilliseconds" : 50,
          "metrics" : {
            "decodeTokensPerSecond" : 108.2503792635307,
            "p50TokenIntervalMilliseconds" : 9.153687999999999,
            "p95TokenIntervalMilliseconds" : 10.05567675,
            "p99TokenIntervalMilliseconds" : 12.041051750000001,
            "peakMemoryMegabytes" : 804.2201766967773,
            "prefillTokensPerSecond" : 387.0074672607082,
            "requestCompletionMilliseconds" : 436.179959,
            "ttftMilliseconds" : 180.933792,
            "userVisibleTTFTMilliseconds" : 182.037084
          },
          "outcome" : "completed",
          "outputTokenCount" : 27,
          "promptTokenCount" : 70,
          "role" : "measured",
          "runIndex" : 1,
          "stopReason" : "endOfSequence",
          "thermalStateAfter" : "nominal",
          "thermalStateBefore" : "nominal",
          "tokenEvents" : [
            {
              "elapsedNanoseconds" : 180933792,
              "index" : 0,